<!ELEMENT Database (UserList,ChatList)>
<!ELEMENT UserList (user*)>
<!ELEMENT ChatList (chat*)>
<!ELEMENT user (password)>
<!ATTLIST user username ID #REQUIRED>
<!ELEMENT password (#PCDATA)>
<!ELEMENT chat (ChatMessage*)>
<!ATTLIST chat id ID #REQUIRED>
<!ELEMENT ChatMessage (Content,Sender,Receiver)>
<!ELEMENT Content (#PCDATA)>
<!ELEMENT Sender (#PCDATA)>
<!ELEMENT Receiver (#PCDATA)>